Ges.-Nr.;Departement;Bezeichnung
"=""09.195""";DVI;"Postulat René Kunz, SD, Reinach, vom 23. Juni 2009 betreffend wirtschaftliche Stärkung der mittleren und kleinen Betriebe in den Randregionen des Kantons durch vermehrte Arbeitsvergabe der kantonalen Verwaltung"
"=""09.194""";BKS;"Postulat der Fraktionen der CVP-BDP (Sprecherin Theres Lepori, Berikon), SP, FDP, Grünen, EVP und GLP vom 23. Juni 2009 betreffend Konzept und transparente Kriterien für die Zuteilung von Zusatzstunden und -lektionen für schwierige Abteilungen"
"=""09.181""";SK;"Postulat Dr. Dragan Najman, SD, Baden, vom 9. Juni 2009 betreffend Verstärkung der Position des Kantons Aargau innerhalb der Schweiz"
"=""09.180""";DVI;"Postulat Martin Christen, SP, Turgi, vom 9. Juni 2009 betreffend Massnahmen des Kantons Aargau zur Erhöhung der Stimm- und Wahlbeteiligung"
"=""09.156""";BVU;"Postulat Eugen Frunz, SVP, Obersiggenthal, vom 5. Mai 2009 betreffend Prüfung eines Lägerndurchstiches zwischen Wettingen (Furttalanschluss) und Ehrendingen (Raum Tiefenwaag) zur Verkehrsentflechtung der Klus Baden genannt ""Nordentlastung"""
"=""09.155""";BVU;"Postulat Martin Bhend, EVP, Oftringen, vom 5. Mai 2009 betreffend Prüfung bzw. Sicherstellung betrieblicher Machbarkeit sowie Richtplanfestsetzung der Haltestelle Zentrum Oftringen"
"=""09.154""";BVU;"Postulat Regula Bachmann-Steiner, CVP, Magden (Sprecherin), Roland Agustoni, SP, Magen, Brunette Lüscher, SVP, Magden, vom 5. Mai 2009 betreffend Prüfung einer Buslinie Rheinfelden-Magden-Sissach"
"=""09.153""";BVU;"Postulat Roland Agustoni, SP, Magden, vom 5. Mai 2009 betreffend ständige Verkehrsüberlastungen bei der Rheinfelder Autobahnzollanlage"
"=""09.106""";DGS;"Postulat der SP-Fraktion vom 31. März 2009 betreffend Strategie gegen Ärztemangel und betreffend Förderung der Hausarztmedizin"
"=""09.105""";DFR;"Postulat der SP-Fraktion vom 31. März 2009 betreffend atypische Arbeitnehmende und steuerrechtliche Selbständigkeit"
"=""09.97""";BKS;"Postulat Trudi Huonder, Egliswil (Sprecherin), Esther Gebhard-Schöni, Möriken-Wildegg, Kathrin Nadler, Lenzburg, Christoph Brun, Brugg, Maja Wanner, Würenlos, vom 24. März 2009 betreffend einheitliche Regelung der Organisation der Musikschulen an der Volksschule"
"=""09.85""";DVI;"Postulat Martin Christen, Turgi, vom 17. März 2009 betreffend Wiedereinsetzung einer gorssrätlichen Redaktionskommission respektive Ergreifung einer anderen geeigneten Massnahme zur Verbesserung der formalen Korrektheit von Gesetzestexten"
"=""09.84""";DVI;"Postulat Alexandra Abbt, Islisberg, vom 17. März 2009 betreffend Massnahmen gegen gewaltverherrlichende Computerspiele"
"=""09.56""";DVI;"Postulat der SVP-Fraktion vom 3. März 2009 betreffend Erhöhung der Sicherheit für die Bevölkerung durch Schaffung einer gemeinsamen Notrufzentrale für alle Blaulichtorganisationen in Schafisheim"
"=""09.47""";BKS;"Postulat Milly Stöckli, Muri, vom 24. Februar 2009 betreffend Kompetent im Alltag - Kompetent in der Schule - Kompetent in der Berufswelt. Alltagskompetenzen/Hauswirtschaft soll im zukünftigen Deutschschweizer Lehrplan aufgenommen werden"
"=""09.46""";BKS;"Postulat Erika Müller, Lengnau, vom 24. Februar 2009 betreffend einheitliche Regelung der Organisation der Musikschulen an der Volksschule"
"=""09.40""";BVU;"Postulat Martin Bhend, Oftringen, vom 24. Februar 2009 betreffend Sanierung des Nationalbahnübergangs auf der K104 zwischen Zofingen und Oftringen"
"=""09.39""";DVI;"Postulat der Kommission für öffentliche Sicherheit (SIK) vom 24. Februar 2009 betreffend Überprüfung des Hausarztsystems bei ärztlichen Prüfungen der Fahreignung von über 70-jährigen Lenkerinnen und Lenkern"
"=""09.18""";BVU;"Postulat Rudolf Lüscher, Laufenburg, vom 20. Januar 2009 betreffend Förderung von Holz als erneuerbaren und einheimischen Energieträger zum Beispiel mit dem Bau eines Holzheizkraftwerks im Kanton Aargau"
"=""09.17""";BVU;"Postulat Martin Keller, Obersiggenthal (Sprecher), und Maja Wanner, Würenlos, vom 20. Januar 2009 betreffend Behebung des Verkehrschaos auf der Schulhausplatz-Kreuzung in Baden"
"=""09.16""";BVU;"Postulat Martin Keller, Obersiggenthal (Sprecher), und Maja Wanner, Würenlos, vom 20. Januar 2009 betreffend Realisierung des Martinsbergtunnels in Baden"
"=""09.8""";BVU;"Postulat Walter Deppeler, Tegerfelden, vom 6. Januar 2009 betreffend Fertigstellung des Rad- und Wanderweges von der Radfahrerüberquerung bis zur Bushaltestelle Richtung Bad Zurzach auf der Passhöhe der Zurzacherbergstrasse (K286)"
"=""09.3""";BVU;"Postulat Hansjörg Wittwer, Aarau, vom 6. Januar 2009 betreffend Einrichtung von Planungszonen von Mobilfunksendeanlagen"
"=""09.2""";DFR;"Postulat der Fraktion der Grünen vom 6. Januar 2009 betreffend Studie, die verbindlich aufzeigt, welche kantonseigenen Gebäude im MINERGIE®-Standard oder nach MuKEn-Anforderungen aus- beziehungsweise umgebaut werden müssen"
"=""08.378""";BVU;"Postulat Sämi Richner, Auenstein, vom 16. Dezember 2008 betreffend Sicherheitsüberprüfung der Verlegungsvariante der Seetalbahn in Boniswil durch die BfU"
"=""08.377""";BVU;"Postulat Jörg Hunn, Riniken, vom 16. Dezember 2008 betreffend Standortgebiete für ein geologisches Tiefenlager im Kanton Aargau; Partizipation der Gemeinden und der Bevölkerung"
"=""08.376""";DVI;"Postulat Martin Christen, Turgi (Sprecher), und Sandra-Anne Göbelbecker, Baden, vom 16. Dezember 2008 betreffend Durchführung kantonaler oder lokaler Staatskundekurse im Rahmen der Einbürgerungsverfahren"
"=""08.367""";BVU;"Postulat der SP-Fraktion vom 9. Dezember 2008 betreffend Rahmenbewilligungsgesuch der Axpo Holding AG für ein neues AKW als Ersatz für Beznau I und II"
"=""08.366""";BVU;"Postulat Herbert Strebel, Muri, vom 9. Dezember 2008 betreffend Befreiung von der Baubewilligungspflicht bei Ersatz von Drainageleitungen in Landwirtschaftsland"
"=""08.361""";BVU;"Postulat Richard Plüss, Lupfig (Sprecher), Jörg Hunn, Riniken, Marianna Mattenberger, Birr, Dr. Jürg Stüssi-Lauterburg, Windisch, vom 2. Dezember 2008 betreffend Verbesserung der Erschliessungssituation des öffentlichen Verkehrs (durchgehende Buslinie) vom Bahnhof Brugg direkt zum Spital Baden"
"=""08.356""";DGS;"Postulat Andreas Villiger, Sins, vom 2. Dezember 2008 betreffend Versicherungsschutz bei Elementarschäden durch die Aargauische Gebäudeversicherung"
"=""08.352""";BKS;"Postulat Kathrin Nadler, Lenzburg (Sprecherin), Otto Wertli, Aarau, Beat Unternährer, Unterentfelden, Rolf Alder, Brugg, und Heinrich Schöni, Oftringen, vom 25. November 2008 betreffend Streichung der Kantonalisierung der Berufsfachschulen aus dem 3. Paket der Aufgabenteilung zwischen Kanton und Gem"
"=""08.349""";BVU;"Postulat Peter Jean-Richard, Aarau, vom 25. November 2008 betreffend Geothermie-Standortabklärung im Zusammenhang mit der Planung möglicher Endlager im Aargau"
"=""08.348""";DFR;"Postulat Susanne Hochuli, Reitnau, vom 25. November 2008 betreffend Studie, die verbindlich aufzeigt, welche kantonseigenen Gebäude im MINERGIE®-Standard oder nach MuKEn-Anforderungen aus- beziehungsweise umgebaut werden müssen"
"=""08.320""";DGS;"Postulat Lilian Studer, Wettingen, vom 4. November 2008 betreffend Erarbeitung eines Gesamtkonzepts pallliative care (Linderung der Beschwerden nicht kurativer Behandlung)"
"=""08.313""";DVI;"Postulat Beat Leuenberger, Schöftland, vom 28. Oktober 2008 betreffend Verbüssung der Strafe von kriminellen Ausländerinnen und Ausländern in ihrem Heimatland"
"=""08.312""";DFR;"Postulat Martin Christen, Turgi, vom 28. Oktober 2008 betreffend kantonales ""Rettungspaket"" zugunsten der Ärmsten dieser Welt sowie zugunsten des tropischen Regenwalds"
"=""08.307""";BVU;"Postulat Urs Leuenberger, Widen, vom 28. Oktober 2008 betreffend Erstellung eines Berichts zum Vergleich von effektiven Fluglärmmessungen zu theoretischen Fluglärmberechnungen"
"=""08.306""";BVU;"Postulat Benjamin Giezendanner, Rothrist, vom 28. Oktober 2008 betreffend sofortigen Ausbau des Teilstücks Härkingen-Wiggertal von vier auf sechs Spuren"
"=""08.305""";DFR;"Postulat der SP-Fraktion vom 28. Oktober 2008 betreffend Konsequenzen aus der Finanzkrise"
"=""08.292""";BVU;"Postulat Gusti Ungricht, Bergdietikon, vom 23. September 2008 betreffend Massnahmen zum Schutz des Kantons Aargau gegen Fluglärm"
"=""08.277""";BVU;"Postulat Vreni Friker-Kaspar, Oberentfelden, vom 9. September 2008 betreffend dringliche Verbesserung der Verkehrssicherheit für Radfahrer auf der Strecke R764: Suhr-Muhen"
"=""08.276""";BVU;"Postulat Vreni Friker-Kaspar, Oberentfelden, vom 9. September 2008 betreffend dringliche Verkehrsmassnahmen im Raum Oberentfelden"
"=""08.253""";BVU;"Postulat Beat Rüetschi, Suhr, vom 26. August 2008 betreffend Autobahnanschluss Wynental an die A1"
"=""08.250""";BVU;"Postulat Richard Plüss, Lupfig, vom 26. August 2008 betreffend Kostenbeteiligung des Kantons an den Sicherheitsholzschlägen entlang von Kantonsstrassen, welche im öffentlichen Interesse stehen"
"=""08.229""";BKS;"Postulat Emanuele Soldati, Staufen, vom 19. August 2008 betreffend Erarbeitung von Leitlinien für die Implementierung von Tagesstrukturen im Kanton Aargau"
"=""08.228""";BKS;"Postulat Theres Lepori, Berikon, vom 19. August 2008 betreffend Verlängerung des Pilotprojekts ""Lehrstellen-Coaching"" Cobe"
"=""08.213""";BVU;"Postulat Andreas Villiger, Sins, vom 1. Juli 2008 betreffend Nutzung der Abwärme von bestehenden und neu geplanten Kernkraftwerken"
"=""08.202""";DGS;"Postulat Barbara Roth, Erlinsbach, vom 1. Juli 2008 betreffend Erhöhung der Tagestaxe für Aufenthalte in stationären Pflegeeinrichtungen oder Spitälern in der Verordnung zu § 2 Abs. 1 lit. a des Ergänzungsleistungsgesetzes Aargau (ELG-AG)"
"=""08.160""";DVI;"Postulat Jörg Hunn, Riniken, vom 17. Juni 2008 betreffend Informationsaustausch und Zusammenarbeit zwischen den Regionalen Arbeitsvermittlungszentren (RAV) und den Gemeinden"
"=""08.117""";BVU;"Postulat Annalise Schweizer, Zufikon, vom 6. Mai 2008 betreffend Schaffung eines Sicherheitskonzepts für die gefahrlose Fussgänger/Spaziergänger-Überquerung auf der neuen Sädelstrasse in Zufikon"
"=""08.73""";DGS;"Postulat Max Läng, Obersiggenthal, vom 18. März 2008 betreffend Überprüfung der Elternschaftsbeihilfe"
"=""08.72""";BVU;"Postulat Beat Leuenberger, Schöftland, vom 18. März 2008 betreffend Vollausbau Südeinfahrt/-ausfahrt Schöftland K 108, Luzernerstrasse K 208"
"=""08.60""";BVU;"Postulat Kurt Rüegger, Rothrist, vom 11. März 2008 betreffend Abzweigespur von der K 101 auf die Autobahneinfahrt A1 Rothrist Richtung Zürich"
"=""08.39""";BVU;"Postulat Fredy Böni, Möhlin, vom 26. Februar 2008 betreffend Schaffung eines Sicherheitskonzepts für den Bahnverkehr auf der Bözbergstrecke"
"=""08.34""";BKS;"Postulat Gusti Ungricht, Bergdietikon, vom 26. Februar 2008 betreffend Massnahmen gegen den Bewegungsmangel und Förderung der Sozialkompetenzen bei Kindergärtnern und Schülern"
"=""08.19""";BKS;"Postulat Susanne Hochuli, Reitnau, vom 8. Januar 2008 betreffend Änderung der schulärztlichen Austrittsuntersuchung"
"=""08.10""";DVI;"Postulat Milly Stöckli, Muri, vom 8. Januar 2008 betreffend differenzierte Statistik über die Anzahl der Suizide und der Tötungen im Kanton Aargau und welche Form dazu ausgelesen wurde"
"=""08.9""";DVI;"Postulat der SP-Fraktion vom 8. Januar 2008 betreffend Härtefallregelung für Asylsuchende im Kanton Aargau"
"=""07.309""";BKS;"Postulat Milly Stöckli, Muri, vom 11. Dezember 2007 betreffend Berücksichtigung der Landeshymne in den aargauischen Lehrplänen"
"=""07.308""";BVU;"Postulat Walter Forrer, Oberkulm, vom 11. Dezember 2007 betreffend Engagement des Regierungsrats für den Sachplan ""Geologische Tiefenlager"""
"=""07.299""";BVU;"Postulat Roland Agustoni, Magden, vom 4. Dezember 2007 betreffend Berücksichtigung und Förderung des Fuss- und Veloverkehrs (Langsamverkehr) im Rahmen der Agglomerationsprogramme"
"=""07.298""";DVI;"Postulat der SP-Fraktion vom 4. Dezember 2007 betreffend differenzierte Statistik über den Waffenmissbrauch"
"=""07.292""";DGS;"Postulat Maja Wanner, Würenlos, vom 27. November 2007 betreffend Einführung eines kantonalen Impfprogramms gegen den HPV-Virus"
"=""07.290""";DGS;"Postulat Lilian Studer, Wettingen, vom 27. November 2007 betreffend Einbau einer Unterrichtseinheit Säuglingspflege, Erziehungshilfe, Kinderkrankheiten und Ernährung von Kleinkindern und Kindern in den integrativen Sprachunterricht von Migranten und in Betrieben mit vielen Arbeitenden aus dem Migrat"
"=""07.289""";DFR;"Postulat Gregor Biffiger, Berikon, Andreas Glarner, Oberwil-Lieli, und Dr. Jürg Stüssi-Lauterburg, Windisch, vom 27. November 2007 betreffend die erneute Senkung des Steuersatzes für juristische Personen auf freiwilliger Basis durch die Gemeinden (gleichlautend wie 07.196)"
"=""07.288""";DVI;"Postulat Gregor Biffiger, Berikon, Andreas Glarner, Oberwil-Lieli, und Dr. Jürg Stüssi-Lauterburg, Windisch, vom 27. November 2007 betreffend die Schaffung einer Freihandelszone im Kanton Aargau (gleichlautend wie 07.201)"
"=""07.274""";DFR;"Postulat Susanne Hochuli , Reitnau, vom 13. November 2007 betreffend Bekämpfung des Feuerbrands, Erarbeitung von Konzepten und Zusammenarbeit mit dem Bund, anderen Kantonen, dem Naturschutz und der Bevölkerung"
"=""07.273""";SK;"Postulat der SP-Fraktion vom 13. November 2007 betreffend Evaluierung des Instrumentes ""Planungsbericht"""
"=""07.272""";BVU;"Postulat der Fraktion der Grünen vom 13. November 2007 betreffend Durchführung einer Positivplanung zur Erkennung des Potenzials an geeigneten windhöfigen Flächen im Kantonsgebiet"
"=""07.259""";DVI;"Postulat der CVP-Fraktion vom 30. Oktober 2007 betreffend Konzentration des Standortmarketings im Kanton Aargau auf die Ansiedelung von wertschopfungsintensiven Branchen und Firmen"
"=""07.237""";DVI;"Postulat Dr. Bernhard Scholl, Möhlin, vom 25. September 2007 betreffend Optimierung des Einbürgerungsverfahrens auf Stufe Gemeinde"
"=""07.223""";DFR;"Postulat der SP-Fraktion vom 18. September 2007 betreffend Verwendung der NFA-Überschüsse"
"=""07.222""";DFR;"Postulat der FDP-Fraktion vom 18. September 2007 betreffend Prüfung der Einführung einer ""Easy Swiss Tax"" (Einheitssteuer mit zwei oder drei Tarifstufen) im Kanton Aargau"
"=""07.201""";DVI;"Postulat Thomas Bodmer, Wettingen, vom 28. August 2007 betreffend die Schaffung einer Freihandelszone im Kanton Aargau"
"=""07.196""";DFR;"Postulat Thomas Bodmer, Wettingen, vom 21. August 2007 betreffend die erneute Senkung des Steuersatzes für juristische Personen auf freiwilliger Basis durch die Gemeinden"
"=""07.175""";BVU;"Postulat Rudolf Lüscher, Laufenburg, vom 3. Juli 2007 betreffend Einführung von Kombi-Abonnementen zwischen dem Tarifverbund Nordwestschweiz und dem integralen Tarifverbund A-WeIIe"
"=""07.174""";BVU;"Postulat Oliver Flury, Lenzburg, vom 3. Juli 2007 betreffend Schaffung gesetzlicher Grundlagen für ein vereinfachtes Verfahren bei geringfügigen technischen Änderungen von Nutzungsplänen"
"=""07.168""";BVU;"Postulat Richard Plüss, Lupfig (Sprecher), Jörg Hunn, Riniken, Marianna Mattenberger, Birr, Dr. Jürg Stüssi-Lauterburg, Windisch, vom 3. Juli 2007 betreffend Realisierung der Lärmschutzwände in der Gemeinde Birrhard entlang der Autobahn A1"
"=""07.152""";DFR;"Postulat Andreas Villiger, Sins, vom 19. Juni 2007 betreffend Umsetzung von Massnahmen zur Eindämmung des Feuerbrands"
"=""07.151""";DFR;"Postulat Andrea Moll-Reutercrona, Sins, vom 19. Juni 2007 betreffend Umsetzung von Massnahmen zur Eindämmung des Feuerbrands"
"=""07.150""";DFR;"Postulat Lukas Bütler, Beinwil (Freiamt), vom 19. Juni 2007 betreffend Umsetzung von Massnahmen zur Eindämmung des Feuerbrands"
"=""07.141""";DGS;"Postulat der SP-Fraktion vom 5. Juni 2007 betreffend Auszahlung von Sozialhilfe an anerkannte Flüchtlinge"
"=""07.127""";DVI;"Postulat Thierry Burkart, Baden, vom 22. Mai 2007 betreffend Überlebens- und Qualitätssicherung der Milizsysteme in Behörden der Gemeinden, der Bezirke und des Kantons Aargau"
"=""07.112""";BVU;"Postulat Dr. Bernhard Scholl, Möhlin, vom 8. Mai 2007 betreffend Bau eines neuen Autobahnanschlusses zur Erschliessung des Entwicklungsschwerpunktes Rheinfelden-Ost/Möhlin"
"=""07.111""";BVU;"Postulat Fredy Böni, Möhlin, vom 8. Mai 2007 betreffend Bau eines neuen Autobahnanschlusses zur Erschliessung des Entwicklungsschwerpunktes Rheinfelden-Ost/Möhlin"
"=""07.110""";BVU;"Postulat Martin Bhend, Oftringen, vom 8. Mai 2007 betreffend Planung / Projektierung und Freihaltung von zusätzlichen Autobahnanschlüssen im Raume Verzweigung Wiggertal (A1/A2)"
"=""07.81""";SK;"Postulat Thierry Burkart, Baden, vom 27. März 2007 betreffend Transparenz im Vollzug von Kantonsaufgaben durch Verwaltungsstellen bzw. Offenlegung der Interessenbindungen"
"=""07.80""";DFR;"Postulat Thomas Bodmer, Wettingen, vom 27. März 2007 betreffend Reduktion des Steuersatzes bei Kapitalbezügen aus der 2. und 3. Säule zur Entlastung der Rentner (Anschlussrevision Steuergesetz)"
"=""07.79""";DFR;"Postulat Thomas Bodmer, Wettingen, vom 27. März 2007 betreffend sofortige Milderung und längerfristige Abschaffung der Dumont-Praxis für die Hauseigentümer"
"=""07.78""";DFR;"Postulat der FDP-Fraktion vom 27. März 2007 betreffend periodische Erhebung zum Thema ""Gebührenbelastung im Kanton Aargau"""
"=""07.69""";DFR;"Postulat Thomas Bodmer; Wettingen, vom 20. März 2007 betreffend Durchführung eines ""Customer Focus""-Programms in der Aargauer Verwaltung im Zusammenhang mit dem Wachstumsprogramm und den Fragen der Standortqualität"
"=""07.66""";BKS;"Postulat der SVP-Fraktion vom 20. März 2007 betreffend korrekten Vollzug der Gesetze und Einhaltung der demokratischen Regeln"
"=""07.65""";BVU;"Postulat der SP-Fraktion vom 20. März 2007 betreffend Förderung der energetischen Sanierung von Altbauten"
"=""07.52""";BVU;"Postulat Guido Weber, Spreitenbach, vom 13. März 2007 betreffend Unterstützung einer nationalen Krähenplattform, Untersuchung von Vogelschäden im Aargau und Vorschläge von Massnahmen zur Reduzierung und Vergütung der Schäden"
"=""07.36""";BVU;"Postulat Andreas Villiger, Sins, vom 6. März 2007 betreffend Hochwassermanagement Reusstal"
"=""07.30""";DGS;"(7199) Postulat Liset Lämmler, Wettingen, vom 5. März 1996 betreffend Förderung und Unterstützung der Gemeinden und Trägerschaften bei der Projektierung, Planung und Realisierung von Pflegewohnungen für pflegebedürftige Betagte"
"=""07.2""";SK;"Postulat der CVP-Fraktion vom 9. Januar 2007 betreffend klare Führung und Strategie für die Informations- und Kommunikationstechnologien des Staates ICT im Aargau"
"=""06.275""";BVU;"(6544) Postulat Martin Troller, Münchwilen, vom 18. Januar 1994 betreffend Bewirtschaftung von Parkplätzen, welche sich im Eigentum des Staates oder seiner Anstalten befinden"
"=""06.274""";BVU;"(4686) Postulat Willi Rusterholz, Niederlenz, vom 8. März 1988 betreffend Parkplatzbewirtschaftung bei staatlichen Liegenschaften"
"=""06.263""";SK;"Postulat Roland Agustoni, Magden, vom 12. Dezember 2006 betreffend Beantwortung und Stellungnahme des Regierungsrats zu Resolutionen"
"=""06.254""";DFR;"Postulat der Fraktion der Grünen vom 5. Dezember 2006 betreffend Durchleuchtung der Immobilienpolitik und der Finanzierung und Abschreibungspraxis bei Hochbauvorhaben des Kantons Aargau"
"=""06.246""";BKS;"Postulat Yvonne Feri, Wettingen, vom 28. November 2006 betreffend Prävention gegen Gewalt"
"=""06.231""";BVU;"Postulat Rudolf Lüscher, Laufenburg, vom 14. November 2006 betreffend Klärung und Koordination zur Ausschöpfung des Holznutzungspotentials im Kanton Aargau"
"=""06.186""";DFR;"Postulat Yvonne Feri, Wettingen, vom 19. September 2006 betreffend Liegenschaftsunterhalt bei der Steuerberechnung"
"=""06.176""";BVU;"Postulat Peter Wehrli, Küttigen (Sprecher), Andrea Moll-Reutercrona, Sins, Andreas Villiger-Matter, Sins, vom 5. September 2006 betreffend Erweiterung der bewilligungsfreien Bauten und Anlagen unter § 30 der Allgemeinen Verordnung zum Baugesetz (ABauV)"
"=""06.175""";DFR;"Postulat der FDP-Fraktion vom 5. September 2006 betreffend Modernisierungspaket Aargau zu den Staatsbeteiligungen"
"=""06.174""";DFR;"Postulat der FDP-Fraktion vom 5. September 2006 betreffend Modernisierungspaket Aargau zum Public Private Partnership"
"=""06.173""";SK;"Postulat der FDP-Fraktion vom 5. September 2006 betreffend Modernisierungspaket Aargau zum Einfluss der Demographie auf die Entwicklung des Kantons"
"=""06.156""";DFR;"Postulat Yvonne Feri, Wettingen, vom 22. August 2006 betreffend Gleichstellungskonzept für die Verwaltung und Betriebe des Kantons Aargau"
"=""06.147""";BKS;"(7050) Postulat Leo Erne, Döttingen, betreffend öffentliche Berufs-, Studien- und Laufbahnberatung im Kanton Aargau vom 22. August 1995"
"=""06.146""";BKS;"(7049) Postulat Christine Egerszegi-Obrist, Mellingen, betreffend Reorganisation der Berufsberatungsdienste im Kanton Aargau vom 22. August 1995"
"=""06.133""";BVU;"Postulat der SP-Fraktion vom 4. Juli 2006 betreffend Klärung der Potentiale und Standorte von Geothermiekraftwerken im Kanton Aargau"
"=""06.110""";BVU;"Postulat Guido Weber, Spreitenbach, vom 13. Juni 2006 betreffend Streichung der zumutbaren Verhütungsmassnahme ""Waldabstand"" in den kantonalen Weisungen über die Verhütung und Vergütung von Wildschweinschäden an landwirtschaftlichen Kulturen"
"=""06.99""";DFR;"Postulat Yvonne Feri, Wettingen, vom 30. Mai 2006 betreffend Gender Budgeting"
"=""06.98""";DGS;"Postulat der FDP-Fraktion vom 30. Mai 2006 betreffend Schaffung eines überregionalen Spitalraums Nordwestschweiz"
"=""06.97""";DGS;"Postulat der CVP-Fraktion vom 30. Mai 2006 betreffend Schaffung eines Gesundheitsraums Nordwestschweiz und Einfluss auf die gesundheitspolitische Gesamtplanung, Spitalkonzeption, Gesundheitsgesetz, Spitalgesetz, Spitalliste"
"=""06.72""";BVU;"Postulat Richard Plüss, Lupfig, vom 2. Mai 2006 betreffend Umfahrung Lupfig, Festsetzung im Richtplan und sofortige Aufnahme ins Bauprogramm"
"=""06.71""";BVU;"Postulat Roland Agustoni, Magden, vom 2. Mai 2006 betreffend Überprüfung der Wiederaufnahme des Wisenbergtunnels in die Liste der Projekte Bahn 2000 2. Etappe"
"=""06.40""";DVI;"Postulat Erika Müller, Lengnau, vom 14. März 2006 betreffend Ausmerzung von Fehlern bei der brieflichen Stimmabgabe"
"=""06.39""";BKS;"Postulat der SP-Fraktion vom 14. März 2006 betreffend Erhebung von Zahlen zur Situation der Leistungsverweigerung an der Volksschule"
"=""06.16""";DVI;"Postulat Annalise Schweizer, Zufikon, vom 21. Februar 2006 betreffend Stationierung eines Blechpolizisten in Dottikon an der K 266 in der Nähe der Liegenschaften/Parzellen 1359 und 1360"
"=""06.15""";BVU;"Postulat Roland Agustoni, Magden, vom 21. Februar 2006 betreffend Überprüfung bestehender und Schaffung neuer Park + Pool - Plätze"
"=""06.7""";DGS;"Postulat Markus Leimbacher, Villigen, vom 24. Januar 2006 betreffend Einbezug der ambulanten und teilstationären Leistungsanbieter in die Gestaltung der künftigen Psychiatriekonzeption"
"=""06.6""";DGS;"Postulat der Fraktion der Grünen vom 24. Januar 2006 betreffend Einbezug der ambulanten und teilstationären Leistungsanbieter in die Gestaltung der künftigen Psychiatriekonzeption"
"=""06.5""";DGS;"Postulat der CVP-Fraktion vom 24. Januar 2006 betreffend Einbezug der ambulanten und teilstationären Leistungsanbieter in die Gestaltung der künftigen Psychiatriekonzeption"
"=""05.318""";BVU;"Postulat der Fraktion der Grünen vom 6. Dezember 2005 betreffend Reduktion der Konzentration von Feinpartikeln in der Umwelt"
"=""05.317""";BKS;"Postulat der FDP-Fraktion vom 6. Dezember 2005 betreffend Planungsbericht ""Bildung und Schule Aargau 2010"""
"=""05.309""";BVU;"Postulat Reto Miloni, Hausen, vom 29. November 2005 betreffend Einführung einer systematischen Raumbeobachtung im Kanton Aargau"
"=""05.308""";BVU;"Postulat Hans Killer, Untersiggenthal, vom 29. November 2005 betreffend erneute Vorlage des Planungsberichts ""energieAARGAU"""
"=""05.307""";BVU;"Postulat Susanne Hochuli, Reitnau, vom 29. November 2005 betreffend Verbesserung der im Aargau betätigten Treibjagden"
"=""05.306""";BVU;"Postulat Walter Forrer, Oberkulm, vom 29. November 2005 betreffend erneute Vorlage des Planungsberichts ""energieAARGAU"""
"=""05.305""";BVU;"Postulat Erwin Berger, Boswil, vom 29. November 2005 betreffend erneute Vorlage des Planungsberichts ""energieAARGAU"""
"=""05.304""";BVU;"Postulat der Fraktion der Grünen vom 29. November 2005 betreffend umgehende Überarbeitung des Planungsberichts energieAARGAU"
"=""05.303""";SK;"Postulat der CVP-Fraktion vom 29. November 2005 betreffend Vertretung des Kantons Aargau in den Verwaltungs-, Bank- und Aufsichtsräten der vom Kanton beherrschten Gesellschaften und Institutionen"
"=""05.299""";DGS;"Postulat Urs Leuenberger, Widen (Sprecher), Rudolf Jost, Villmergen, Thomas Leitch-Frey, Hermetschwil-Staffeln, und Walter Stierli, Fischbach-Göslikon, vom 22. November 2005 betreffend Erweiterung der Stützpunkt B Aufgaben"
"=""05.294""";BKS;"Postulat Beat Unternährer, Unterentfelden, vom 15. November 2005 betreffend Planungsbericht über ein allfälliges Projekt ""Harmonisierung der aargauischen Schulstrukturen"" mit der pädagogischen Zielrichtung"
"=""05.293""";DVI;"Postulat Markus Leimbacher, Villigen, vom 15. November 2005 betreffend Anpassung der Funktionsbezeichnunggen der Gemeindebehörden"
"=""05.292""";DFR;"Postulat Hans Killer, Untersiggenthal, vom 15. November 2005 betreffend Schaffung einer Kommission für kantonale Hochbauten"
"=""05.285""";SK;"Postulat Lilian Studer, Wettingen, vom 8. November 2005 betreffend Stellungnahme im Abstimmungsbüchlein beim Behördenreferendum"
